{
  "$schema": "https://json-schema.org/draft/2020-12/schema",
  "$id": "https://local.ai-office/schemas/automation-rule-schema.json",
  "title": "AI Office Automation Rule",
  "type": "object",
  "required": [
    "rule_id",
    "name",
    "enabled",
    "priority",
    "trigger",
    "conditions",
    "actions",
    "created_at",
    "updated_at"
  ],
  "properties": {
    "rule_id": {
      "type": "string",
      "pattern": "^AUT-[A-Z0-9-]+$"
    },
    "name": {
      "type": "string",
      "minLength": 1
    },
    "description": {
      "type": "string"
    },
    "enabled": {
      "type": "boolean"
    },
    "priority": {
      "type": "integer",
      "minimum": 1,
      "maximum": 1000
    },
    "trigger": {
      "type": "object",
      "required": [
        "type"
      ],
      "properties": {
        "type": {
          "type": "string"
        },
        "schedule": {
          "type": "string"
        },
        "source": {
          "type": "string"
        },
        "event_name": {
          "type": "string"
        }
      }
    },
    "conditions": {
      "type": "array"
    },
    "actions": {
      "type": "array",
      "minItems": 1
    },
    "created_at": {
      "type": "string"
    },
    "updated_at": {
      "type": "string"
    }
  }
}
